{
  "$schema": "https://json-schema.org/draft/2020-12/schema",
  "$id": "https://github.com/mahsan07/agent-handoff-kit/schema/handoff.schema.json",
  "title": "Agent Handoff",
  "type": "object",
  "required": ["schema_version", "id", "title", "objective", "status", "owner", "next_owner", "reviewer", "scope", "artifacts", "decisions", "assumptions", "risks", "next_actions", "verification", "events", "created_at", "updated_at"],
  "properties": {
    "schema_version": {"const": "1.0"},
    "id": {"type": "string", "minLength": 1},
    "title": {"type": "string", "minLength": 1},
    "objective": {"type": "string", "minLength": 1},
    "status": {"enum": ["draft", "ready", "accepted", "completed", "returned"]},
    "owner": {"type": "string", "minLength": 1},
    "next_owner": {"type": "string", "minLength": 1},
    "reviewer": {"type": "string", "minLength": 1},
    "scope": {"type": "array", "items": {"type": "string"}},
    "artifacts": {"type": "array", "items": {"type": "object", "required": ["kind", "uri"], "properties": {"kind": {"enum": ["file", "url", "commit", "note"]}, "uri": {"type": "string", "minLength": 1}, "description": {"type": "string"}}}},
    "decisions": {"type": "array", "items": {"type": "string"}},
    "assumptions": {"type": "array", "items": {"type": "string"}},
    "risks": {"type": "array", "items": {"type": "string"}},
    "next_actions": {"type": "array", "items": {"type": "string"}},
    "verification": {"type": "array", "items": {"type": "string"}},
    "return_reason": {"type": ["string", "null"]},
    "events": {"type": "array", "items": {"type": "object"}},
    "created_at": {"type": "string", "format": "date-time"},
    "updated_at": {"type": "string", "format": "date-time"}
  },
  "additionalProperties": false
}
